{
  "schemaVersion": 1,
  "status": "screening-unverified",
  "purpose": "Development smoke corpus for deterministic quoted-source screening. Caption text and boundaries are machine-derived. Except for the origin sequence around code coverage 20:42, labels have not been checked against recording playback and are not gold or a held-out test.",
  "sources": [
    {
      "sourceId": "youtube:S_7SE_Uzk-I",
      "captionTrack": "en-orig auto-generated JSON3",
      "captionSha256": "b2c5d3c46282bb17f6e47f1d90f86467c18f9c8ff4d14c4aff93879f1cac04ef",
      "screeningMethod": "full-caption Sol Ultra pass"
    },
    {
      "sourceId": "youtube:IInciWyU74U",
      "captionTrack": "en-orig auto-generated JSON3",
      "captionSha256": "20c799667ee357d39d886d6b3f599fecca3a7e8c8c2da62b81f9a9169cc1564d",
      "screeningMethod": "full-caption Sol Ultra pass"
    },
    {
      "sourceId": "youtube:20SkiBvylyM",
      "captionTrack": "en-orig auto-generated JSON3",
      "captionSha256": "da58c1e23bf49d5483baafb33f5571cd90993f9c1e6740435853c812ddbecab1",
      "screeningMethod": "full-caption Sol Ultra pass"
    }
  ],
  "cases": [
    {
      "caseId": "attr_dev_coverage_chat_first_person",
      "split": "development",
      "sourceId": "youtube:S_7SE_Uzk-I",
      "startMs": 119119,
      "endMs": 130480,
      "input": {
        "previousText": "oh I like this",
        "text": "in my opinion the bottom line as you can enforce thinking through something with policy Gates I don't think you can force somebody to become a good tester by saying that they need 100% coverage I think you'll get a bunch of lazy tests that get there",
        "nextText": "okay thank you Bry I appreciate that"
      },
      "screening": {
        "label": "quoted-source",
        "wordsFrom": "twitch-chat",
        "confidence": 0.95,
        "reviewStatus": "screening-unverified",
        "evidenceBasis": "auto-captions-and-discourse",
        "notes": "Read-preface and named thank-you bracket a first-person chat opinion."
      }
    },
    {
      "caseId": "attr_dev_coverage_article_claim",
      "split": "development",
      "sourceId": "youtube:S_7SE_Uzk-I",
      "startMs": 188280,
      "endMs": 195280,
      "input": {
        "text": "you update the production code and no test failed it might be a bad sign you probably need to cover your code you are modifying with enough tests",
        "nextText": "I don't know if I actually agree with the statement either"
      },
      "screening": {
        "label": "quoted-source",
        "wordsFrom": "screen-source",
        "confidence": 0.94,
        "reviewStatus": "screening-unverified",
        "evidenceBasis": "auto-captions-and-linked-source",
        "notes": "Article claim is followed by an explicit reference to the statement."
      }
    },
    {
      "caseId": "attr_dev_coverage_article_response",
      "split": "development",
      "sourceId": "youtube:S_7SE_Uzk-I",
      "startMs": 195280,
      "endMs": 204280,
      "input": {
        "previousText": "you update the production code and no test failed it might be a bad sign",
        "text": "I don't know if I actually agree with the statement either again if you update your code and no test fail I don't see how that's bad or good"
      },
      "screening": {
        "label": "response",
        "wordsFrom": "speaker-original",
        "confidence": 0.99,
        "reviewStatus": "screening-unverified",
        "evidenceBasis": "auto-captions-and-linked-source",
        "notes": "Explicit disagreement starts Prime's response."
      }
    },
    {
      "caseId": "attr_dev_coverage_creator_workflow",
      "split": "development",
      "sourceId": "youtube:S_7SE_Uzk-I",
      "startMs": 497560,
      "endMs": 518159,
      "input": {
        "text": "I mean that's another reason why I write test is because guess what it is a thousand times easier testing this in a test than it is trying to test it while running it and so whenever you get into this part where people aren't writing tests I often think the environment to write tests is more difficult to test and run than the thing itself"
      },
      "screening": {
        "label": "creator-original",
        "wordsFrom": "speaker-original",
        "confidence": 0.98,
        "reviewStatus": "screening-unverified",
        "evidenceBasis": "auto-captions-and-discourse",
        "notes": "Personal workflow rationale without a detected source-reading boundary."
      }
    },
    {
      "caseId": "attr_dev_coverage_creator_argument",
      "split": "development",
      "sourceId": "youtube:S_7SE_Uzk-I",
      "startMs": 562120,
      "endMs": 572480,
      "input": {
        "text": "my argument is that we should make good tests for things that are very valuable we should not make tests for the sake of making a test"
      },
      "screening": {
        "label": "creator-original",
        "wordsFrom": "speaker-original",
        "confidence": 0.99,
        "reviewStatus": "screening-unverified",
        "evidenceBasis": "auto-captions-and-discourse",
        "notes": "Explicit argument cue."
      }
    },
    {
      "caseId": "attr_dev_coverage_creator_rejects_metric",
      "split": "development",
      "sourceId": "youtube:S_7SE_Uzk-I",
      "startMs": 1006160,
      "endMs": 1014959,
      "input": {
        "text": "this is why I don't like 100% code coverage is this exact same reason is that you end up writing you it hides to you the real reason what things are not being tested"
      },
      "screening": {
        "label": "creator-original",
        "wordsFrom": "speaker-original",
        "confidence": 0.99,
        "reviewStatus": "screening-unverified",
        "evidenceBasis": "auto-captions-and-discourse",
        "notes": "Explicit first-person rationale."
      }
    },
    {
      "caseId": "attr_dev_coverage_chat_dialogue_repair",
      "split": "development",
      "sourceId": "youtube:S_7SE_Uzk-I",
      "startMs": 1075280,
      "endMs": 1075760,
      "input": {
        "text": "I never said",
        "nextText": "I know you didn't say that but still people are getting this idea"
      },
      "screening": {
        "label": "quoted-source",
        "wordsFrom": "twitch-chat",
        "confidence": 0.7,
        "reviewStatus": "screening-unverified",
        "evidenceBasis": "auto-captions-and-discourse",
        "notes": "Short common phrase; useful abstention and dialogue-repair challenge."
      }
    },
    {
      "caseId": "attr_dev_coverage_dialogue_response",
      "split": "development",
      "sourceId": "youtube:S_7SE_Uzk-I",
      "startMs": 1075760,
      "endMs": 1092320,
      "input": {
        "previousText": "I never said",
        "text": "I know you didn't say that I I know you didn't say that but still people are getting this idea there's people that argue that 100% is good I I'd say 100% means nothing that's what I say 100% code coverage means nothing"
      },
      "screening": {
        "label": "response",
        "wordsFrom": "speaker-original",
        "confidence": 0.98,
        "reviewStatus": "screening-unverified",
        "evidenceBasis": "auto-captions-and-discourse",
        "notes": "Direct dialogue repair followed by a position."
      }
    },
    {
      "caseId": "attr_dev_coverage_article_summary",
      "split": "development",
      "sourceId": "youtube:S_7SE_Uzk-I",
      "startMs": 1148440,
      "endMs": 1157200,
      "input": {
        "text": "as we saw High code coverage is not enough it's a good starting point but it must not be the final goal we can indeed focus our efforts in different areas testing quality prioritize writing meaningful tests",
        "nextText": "again this is is it's meaningless I mean for the average product"
      },
      "screening": {
        "label": "quoted-source",
        "wordsFrom": "screen-source",
        "confidence": 0.95,
        "reviewStatus": "screening-unverified",
        "evidenceBasis": "auto-captions-and-linked-source",
        "notes": "Article summary is followed by an explicit rejection."
      }
    },
    {
      "caseId": "attr_dev_coverage_preference_response",
      "split": "development",
      "sourceId": "youtube:S_7SE_Uzk-I",
      "startMs": 1157200,
      "endMs": 1190960,
      "input": {
        "previousText": "prioritize writing meaningful tests",
        "text": "again this is is it's meaningless I mean for the average product not talking let's not talk about the specialty cases I think the best way the best way to have a well-running project is to have is to have tests easier to write and run to test your project than to run your project itself and I think as long as you can always have tests that drive any difficult feature I think you'll have simply a better you'll have a better experience that's the only way I think it could be done"
      },
      "screening": {
        "label": "response",
        "wordsFrom": "speaker-original",
        "confidence": 0.99,
        "reviewStatus": "screening-unverified",
        "evidenceBasis": "auto-captions-and-linked-source",
        "notes": "Strongest same-video candidate for the user's remembered testing preference."
      }
    },
    {
      "caseId": "attr_dev_coverage_2042_chat",
      "split": "development",
      "sourceId": "youtube:S_7SE_Uzk-I",
      "startMs": 1242559,
      "endMs": 1243640,
      "input": {
        "text": "the reverse funnel",
        "nextText": "I do like integration testing but they're also can be very difficult"
      },
      "screening": {
        "label": "quoted-source",
        "wordsFrom": "twitch-chat",
        "confidence": 0.78,
        "reviewStatus": "user-reviewed-window",
        "evidenceBasis": "user-playback-window-plus-auto-captions",
        "notes": "The user verified a chat-reading then response sequence around 20:42. Exact ASR words and split remain unreviewed."
      }
    },
    {
      "caseId": "attr_dev_coverage_2042_response",